{
  "application_id": "APP-2026-KA-001",
  "document_id": "doc_fire_noc_001",
  "doc_type": "FIRE_NOC",
  "completeness_status": "COMPLETE",
  "missing_fields": [],
  "facts": [
    {
      "application_id": "APP-2026-KA-001",
      "document_id": "doc_fire_noc_001",
      "source": "doc",
      "entity": "FIRE_NOC",
      "key": "institution_name",
      "raw": "Oxford Engineering College",
      "value_type": "string",
      "value": "Oxford Engineering College",
      "parse_state": "ok",
      "conf": 1.0,
      "conf_kind": "regex_exact",
      "grounded": true,
      "source_ref": "B1_2",
      "page": 1,
      "bbox_norm": [0.1, 0.18, 0.9, 0.24],
      "bbox_precision": "block",
      "extractor": "regex:institution_name",
      "extractor_version": "4.0.0",
      "needs_confirmation": false,
      "simulated": true
    },
    {
      "application_id": "APP-2026-KA-001",
      "document_id": "doc_fire_noc_001",
      "source": "doc",
      "entity": "FIRE_NOC",
      "key": "certificate_no",
      "raw": "FIRE/KA/2024/00123",
      "value_type": "string",
      "value": "FIRE/KA/2024/00123",
      "parse_state": "ok",
      "conf": 1.0,
      "conf_kind": "regex_exact",
      "grounded": true,
      "source_ref": "B1_3",
      "page": 1,
      "bbox_norm": [0.12, 0.26, 0.6, 0.3],
      "bbox_precision": "word",
      "extractor": "regex:certificate_no",
      "extractor_version": "4.0.0",
      "needs_confirmation": false,
      "simulated": true
    },
    {
      "application_id": "APP-2026-KA-001",
      "document_id": "doc_fire_noc_001",
      "source": "doc",
      "entity": "FIRE_NOC",
      "key": "issued_on",
      "raw": "10th April 2024",
      "value_type": "string",
      "value": "2024-04-10",
      "parse_state": "ok",
      "conf": 1.0,
      "conf_kind": "regex_exact",
      "grounded": true,
      "source_ref": "B1_4",
      "page": 1,
      "bbox_norm": [0.15, 0.32, 0.55, 0.36],
      "bbox_precision": "word",
      "extractor": "regex:issued_on",
      "extractor_version": "4.0.0",
      "needs_confirmation": false,
      "simulated": true
    },
    {
      "application_id": "APP-2026-KA-001",
      "document_id": "doc_fire_noc_001",
      "source": "doc",
      "entity": "FIRE_NOC",
      "key": "valid_till",
      "raw": "31st March 2026",
      "value_type": "string",
      "value": "2026-03-31",
      "parse_state": "ok",
      "conf": 1.0,
      "conf_kind": "regex_exact",
      "grounded": true,
      "source_ref": "B1_5",
      "page": 1,
      "bbox_norm": [0.15, 0.38, 0.58, 0.42],
      "bbox_precision": "word",
      "extractor": "regex:valid_till",
      "extractor_version": "4.0.0",
      "needs_confirmation": false,
      "simulated": true
    }
  ],
  "pipeline_stage": "S6_EXTRACTION",
  "idempotent_cached": false,
  "simulated": true,
  "advisory": true
}
